sentence|category
Modern languages change all the time.|1
Would you like to exchange links?|1
Where would you prefer to sit, in the front or in the back?|2
Would you like to stay here with us?|1
Would you like coffee or tea with your breakfast?|2
Do you really want to wait till Tom shows up?|2
Don't you want to know what this is all about?|2
Would you like to play with us?|1
Would you like to go for a swim with me?|2
Where would you prefer to sit, in the front or in the back?|2
Would you like to stay here with us?|1
Would you like to eat with us?|1
Do you want an apple?|1
Do you want to open up your own restaurant?|2
Do you want to leave it like that?|1
Do you want me to wrap it up as a gift?|2
Do you want me to drive?|1
Would you prefer to be examined by a male nurse?|2
Would you like to sit on my knee?|1
Would you like another piece of cake?|1
Would you like to go for a swim with me?|2
Where would you prefer to sit, in the front or in the back?|2
Would you like to stay here with us?|1
Do you want to visit this monument?|1
This juice would be even better with two ice cubes.|2
If you pour a lot of dressing on your salad, it cancels out some of the healthiness of the salad itself.|3
I wonder how many boyfriends Mary has had.|1
Who's Tom traveling with?|1
With whom are you talking?|1
What bus can I take to get to the airport?|2
If Tom were here, we'd be having more fun.|2
I'm not going to speak to Tom anymore.|1
Tom is easy to talk to.|1
There's something the matter with my car.|1
Win with class, lose with dignity.|1
Using examples speeds up language acquisition.|1
It's easy to stir up the peasants with outrageous statements.|2
Doing something with a friend is more fun than doing it by yourself.|2
We could build several houses with this money.|1
The grass came to life with the coming of spring.|2
You spend more time with them than me.|1
Never again will I talk to him.|1
It takes an hour by bus.|1
It takes an hour by bus.|1
I'm not in touch with the older of my elder brothers, but I meet with the other one every week.|2
With your experience, any company would hire you right away.|2
In other words, Tom is lazy.|1
In other words, you're a fool.|1
When he was 18, he married.|1
My bag was stolen.|1
I've been put in charge of this project.|1
I felt like screaming.|1
I didn't really feel like drinking coffee.|1
My arm hurts.|1
My left leg hurts.|1
My eyes are watering.|1
I have a nasty feeling that something awful is going to happen.|2
I heard an interesting rumor.|1
My scalp is itchy.|1
My eyes feel itchy.|1
I got soap in my eyes.|1
I don't feel like celebrating.|1
I'm bored. Let's do something.|1
I'm cold. Would you mind turning the heating on?|2
I know the matter well enough.|1
I feel like doing something different today.|1
I realize the effort you have put into this project and I really appreciate it.|2
I thought you said you were going to buy me a drink.|2
I've enjoyed traveling with you.|1
I had a lot of fun traveling with you.|2
I enjoyed traveling with you.|1
I'm alright.|1
I'm doing OK.|1
I like what you've written.|1
I don't like it either, but that's just the way the system works.|2
I really like the language I'm learning.|1
I don't like the sound of my own voice.|2
I don't like your face.|1
I like your new hair color.|1
I don't like the house he lives in.|1
I don't have the patience for this.|1
I can't think of the word for it. How would you say it in French?|2
I can't think of the word for it. Can you describe it?|2
I don't care what it is.|1
I'm a native speaker and this sentence strikes me as unnatural.|2
I'm a native speaker and this sentence strikes me as unnatural.|2
Minsk is the capital of Belarus.|1
Millions of farmers had to look for other work.|2
Milky Way is a chocolate bar distributed by the Mars Confectionery Company.|2
Two-percent milk tastes better than skim.|1
Mike, how's it going?|1
Mike and Tom are in the same class.|1
Mike is the tallest of the three.|1
It makes me shiver just to think of it.|2
I think the cat is dreaming — she's moving her paws.|2
Michael is a man's name, but Michelle is a woman's name.|2
Usually, meteoroids burn up in the atmosphere and never reach the ground. A meteorite is the chunk of material that does reach the ground.|3
Wow, what a fast horse!|1
Jeez, Tom, close the window! No wonder it's so cold in here!|2
Especially challenged people sounds better than handicapped persons.|1
People make mistakes, and you are the best example of that.|2
People can't live without water.|1
People who starve themselves and mask themselves so that they can conform to what society deems beautiful are only hurting themselves.|3
People who have similar personalities feel sympathy for one another.|2
Melanie is busy right now.|1
My train left at six and arrived at ten.|2
My room is three times as large as yours.|2
I've always been true to my word.|1
My toolbox contains only pliers, a hammer, and a screwdriver.|2
I keep my tools in the garage.|1
My front left tire is losing air.|1
My Hungarian friend said that Toki Pona is his spider, but he did not explain what he meant by that.|2
My dream came true.|1
My dream is to go to Japan.|1
My dream house has two bedrooms.|1
My nerdy friend said it's dangerous to mix muriatic acid and bleach.|2
My pride prevented me from borrowing money from him.|2
Do you think that Tom was the one who did that?|2
Do you mean the planet or the goddess?|1
My toy is broken.|1
My son really likes slugs. He says they're sticky and slippery, and he finds that fascinating.|2
My psychiatrist is Dr Jackson.|1
My internship ends today.|1
My dad doesn't drive because he's afraid of getting in an accident.|2
My grandpa was an avid collector of stamps.|1
My uncle lives in New York.|1
My uncle is slim, but my aunt is fat.|2
My uncle has been to Finland.|1
My name is Tom, and this is Mary.|1
My name is not Tom.|1
My name is Mary and this is Tom.|1
My name cannot be pronounced by Earthlings, but you may call me Tom.|2
My motorcycle is new.|1
My knife has lost its edge.|1
My husband always reads in bed.|1
My husband ran off with someone younger.|1
My husband said he would come back soon. It's been two years.|2
My left foot is asleep.|1
My life was in danger.|1
My life is like a test that I haven't studied for.|2
My life is like a test I haven't studied for.|2
My pumpkin was the best.|1
My body cried for sleep.|1
My kid doesn't do things like that.|1
My Wi-Fi sucks.|1
My dog barks at strangers.|1
My hobby is collecting stamps.|1
My heart was filled with sorrow.|1
My heart is green and yellow.|1
My house is designed to withstand an earthquake.|1
My house is north of the city.|1
My house is on the riverbank.|1
My cellphone fell on the floor.|1
My grandfather was murdered during the Second World War.|2
My grandfather on my father's side is celebrating his 88th birthday tomorrow.|2
My grandfather gave me a birthday present.|1
My baggage was lost in transit.|1
My wallet's gone.|1
My whole day was full of surprises.|1
I had beer for breakfast.|1
My friend hasn't come back yet.|1
My boyfriend is smart, handsome, and friendly too.|1
My boyfriend lied to me.|1
My friend got married last month.|1
My French teacher isn't a Canadian.|1
My French has improved at the expense of my English.|2
I think my French is really bad.|1
My flight leaves in less than an hour.|1
My bicycle was stolen.|1
My signature was forged.|1
I had my watch stolen.|1
My watch has been stolen.|1
My watch loses three minutes a week.|1
My daughter was born in this hospital.|1
My daughter is fast asleep.|1
As a child, my daughter had frequent asthma attacks.|2
My sunglasses are newer than yours.|1
My donkey died.|1
My secretary understands French quite well.|1
My sister wants to go on a road trip across Europe.|2
My sister saw it with her own eyes.|1
My sister has become a good pianist.|1
My sister will get married early next year.|1
My sister has three times as many books as I do.|2
My sister has a fear of little mice and spiders.|2
My sister often takes the bus from Nijmegen to Kleve.|2
My sister's going to kill me.|1
My sister's work is teaching English.|1
My shoes aren't here.|1
My shoes were hurting me until I wore into them a bit.|2
My worst apprehensions have come true.|1
None of my clothes fit anymore.|1
In my opinion, Tom is just a fool.|1
My right hand is numb.|1
“In my view, young people who don’t care about climate change are not paying attention,” he wrote.|2
My plans failed miserably.|1
Do you think she'd go out with me?|1
Do you think it might not have been an accident?|2
My niece works at a sheltered workshop.|1
My English is terrible.|1
My parents don't like my boyfriend because of his race.|2
My parents don’t like the way I dress.|1
Seeing my brother trembling before the urchins mocking him made me anxious and angered at the same time.|2
My mother wants me to study in Switzerland.|1
My mother died when I was a child.|1
My mother doesn't speak English very well.|1
My mother speaks slowly.|1
My mother looks young for her age.|1
My mom always says that she will visit me soon.|2
My mother said that she was all right.|1
My mother can't ride a bicycle.|1
My mother was sick for two days.|1
My mother is an alcoholic.|1
My mother bought two bottles of orange juice.|1
My mother hasn't slept in 3 days due to her illness.|2
My mother forgot to add salt to the salad.|2
My mother has made me what I am today.|2
My mother bought my little brother a yellow umbrella.|2
My mother cooked a big turkey for Thanksgiving.|1
My mission is of critical importance.|1
My opinion doesn't count for much at the office.|2
My opinion about Tom hasn't changed.|1
My mom always loved me.|1
My favorite color is brown.|1
My love for you won't let me tell you everything. Some things are better left unsaid.|2
My love, if the food isn't ready by seven o'clock, I'm going to go to the restaurant.|2
My teachers are very strict.|1
My teachers are very strict.|1
My teacher has a very soft voice.|1
My credit card was rejected by the ATM.|1
My kids love me.|1
My children love me.|1
My cat understands French, but she pretends not to.|2
My cat understands French, but she pretends not to.|2
My cat likes to look through the window.|1
My cats love me.|1
My cat doesn't like being petted.|1
I take my camera wherever I go.|1
My youngest daughter is called Mary.|1
My only critique for my car was its acceleration.|2
My grandmother's hair is white.|1
My grandmother has white hair.|1
My grandmother attributes her good health to active living.|2
My friend lives near the Swiss German border.|1
My friend lives near the border of Switzerland and Germany.|2
My girlfriend sometimes flirts with other boys.|1
My friend hasn't come back yet.|1
My girlfriend is Chinese.|1
My friend got married last month.|1
My wife is suffering from pneumonia.|1
My wife has just cleared the table.|1
There are three children in my family.|1
My education has made me what I am.|1
My parents live in a cottage.|1
My parents were proud of me.|1
My parents hardly ever punished me for anything.|1
My wallet has been stolen, so I'm going to call the police.|2
My best friend walked by and totally ignored me.|2
My comment sparked off an argument in the group.|2
My acquaintance with Esperanto enabled me to look deeper into the make-up and function of language.|2
My legs ache from sitting on tatami.|1
My watch needs to be repaired.|1
My job consists of creating problems.|1
My oldest daughter's name is Chizuru.|1
My third child was born four years after the first, on the same day.|2
My Thunderbird sorts notification e-mails from Tatoeba into three different folders without my having asked it to do so.|2
My computer won't start up anymore.|1
My computer has got to be useful for something.|2
My brother's going to kill me.|1
My brother sent me a letter last week.|1
My brother was always wasteful with his money.|1
My brother is rich.|1
My brother died of cancer last year.|1
My brother is evil.|1
My brother bought a used car, so it was not very expensive.|2
My brother suffered so much from the other kids calling him a Prussian|2
My brother taught me how to swim.|1
My letter should have reached him about this time.|2
My flowerbed was ruined by my neighbor's cats.|1
My bra is dirty.|1
My car is under repair.|1
My car is being repaired.|1
My older brother is really tall. He's about 180 centimeters.|2
More and more people look for natural treatments.|1
Polyglots are much sexier.|1
Several people came to Tom's aid when a couple of muggers attacked him.|2
Several people went to Tom's aid when he fell in the street.|2
Several recent violent incidents involving older Asian Americans have increased worries over anti-Asian bigotry.|2
I love drawing more than anything in the world.|2
I love painting more than anything in the world.|2
I love reading more than anything in the world.|2
Add the flour, salt, baking powder and mashed bananas, and work into a dough.|2
Seafood only tastes good if it's fresh.|1
Mayuko was alone in the room.|1
Math was created to torture children.|1
Mathematics is an easy subject for me.|1
Tadasu Masuda lives in Kobe, Japan. He is trying low-alcohol beers as a way to give his liver a day off.|3
Mary will catch us.|1
Mary sat on the Sybian.|1
Mary told him not to waste his time.|1
Mary's not in.|1
Mary's not at home.|1
Mary is not at home.|1
Mary is not a huge football fan.|1
Mary is a chav.|1
Mary doesn't eat red meat.|1
Mary received many gifts for her birthday.|1
Mary brought Tom a plate of cookies.|1
Mary lived in a convent for a few months.|2
Mary has always been successful in everything she has done.|2
Mary Hansen was an Australian musician and a member of the group Stereolab.|2
Mary confessed that she prefers well-endowed men.|1
Mario has a thick Italian accent.|1
Mary has Hashimoto's thyroiditis.|1
Mary has Hashimoto's.|1
Mary changed into something more comfortable.|1
Mary didn't know what she should be doing.|1
Mary got angry when she found the door locked.|2
Maria got married unwillingly.|1
Maria got married against her will.|1
Mary wished she had more time.|1
Mary didn't want to tell Tom that she'd lost all her money.|2
Tom was the only person Mary wanted to talk to.|2
Maria lives in Helsinki.|1
Mary will not like this.|1
Mary will consider this.|1
Mary wants to learn Serbian.|1
Mary knows more than she's letting on.|1
Mary cried until she ran out of tears.|1
Mary cried when she heard the story.|1
Mary, what's wrong with you today?|1
Mary only washes in spring water.|1
Mary was surprised by how small the baby was.|2
After Mary saw a squirrel for the first time, she was very excited and drew many pictures of squirrels.|2
Mary tried to compose herself.|1
Mary promised Tom that she'd quit smoking.|1
Mary teaches art.|1
Mary is an art teacher.|1
Mary and some other women were here for a few hours.|2
Mary and her sister have a similar hairstyle.|1
Mary and I remained good friends for years.|1
Mary and Alice pretended they were sisters.|1
Mary and Alice are Tom's daughters.|1
Mary was wearing a blue skirt.|1
Mary likes milk.|1
Mary dreamed that she had won the contest.|1
Mary is still wearing the ring Tom gave her.|2
Mary doesn't wear jewelry.|1
Mary doesn't wear lipstick.|1
Mary is wearing a colorful kimono.|1
Marie is looking for her cat.|1
Mary wiped the sand from her legs.|1
Mary got out of the swimming pool and dried herself with a towel.|2
Mary can speak three languages.|1
Mary still plays with dolls.|1
Mary is saving money to go to Japan.|1
Mary sat on the floor and wrapped her arms around her knees.|2
Tom is Mary's only hope.|1
Mary only uses lowercase letters when she texts, and she rarely uses punctuation.|2
Mary doesn't wear makeup, because she doesn't need to.|2
Mary, stop it. That's enough.|1
Mary locked herself in her room and refused to come out.|2
Mary didn't seem to know what she was doing.|2
Mary looked into the mirror while she was brushing her hair.|2
Mary's pronunciation problems grew noticeably when she was mad. Tom found them so adorable that he couldn't help smiling, but this usually made things worse.|3
Mary sat in the shade of a willow tree playing her flute.|2
Mary was sitting on the couch alone.|1
Mary sent Tom a selfie.|1
Maria salted the meat.|1
Mary saw Tom off as he went to school smiling.|2
Mary looked appalled.|1
Mary told Tom she thought he was an idiot.|2
Mary told Tom that she thought John wasn't sleepy.|2
Mary told Tom that she thought John was busy.|2
Mary told Tom that she thought John was broke.|2
Mary told Tom that she thought John was heartbroken.|2
Mary told Tom that she thought John was nice.|2
Mary told Tom that she thought John was fat.|2
Mary told Tom that she thought John was suspicious.|2
Mary said that Tom kissed her.|1
Mary told Tom that she thought John was engaged to Alice.|2
Mary told Tom that she thought John was healthy.|2
Mary told Tom that she thought John was worried.|2
Mary said she was going to be late.|1
Mary said that she didn't want to drive.|1
Mary said that she was broke.|1
Mary said she wasn't the one who told Tom to do that.|2
Mary said she'd like to have another cup of coffee.|2
Mary told me that she thought Tom was disappointed.|2
Mary told me she didn't know anyone who lived on Park Street.|2
Mary said everybody she knows can swim.|1
Mary said that she was irritated.|1
Mary said that she was mistaken.|1
Mary said that she was ticklish.|1
Mary said that she was happy.|1
Mary said that somebody was after her.|1
Mary dragged herself out of bed.|1
Mary cleaned her room in a hurry.|1
Mary doesn't use lipstick.|1
Mary is opening the skylight.|1
Mary is opening the roof window.|1
Mary is opening the roof light.|1
Mary moved closer to him.|1
Mary said Tom thought she might be permitted to do that by herself.|2
Mary said she thought I looked like I was tired.|2
Mary doesn't like men who look like Tom.|1
Mary likes futa porn the best.|1
Mary skated on the frozen pond.|1
Mary loves reading.|1
Mary loves money.|1
Mary took off her clothes.|1
Mary lives far from me, but I often think about her.|2
Mary was really bored.|1
Mary could barely contain her excitement.|1
Mary couldn't deny that she found him handsome.|1
Mary, come back to Paris with me.|1
Mary chewed on her nails nervously.|1
Mary's buying a new percolator.|1
Mary's buying a new coffee machine.|1
Mary is a virtuoso recorder player.|1
Mary came out of the shower with a towel wrapped around her head.|2
Mary is probably rich.|1
Mary recovered from her illness.|1
Mary is proud of her son.|1
Mary is even more beautiful than Alice.|1
Mary is even more beautiful than you told me she was.|2
Mary is slimmer than me.|1
Mary isn't unattractive.|1
Maria isn't Tom's enemy.|1
Mary isn't yet as tall as her mother.|1
Mary isn't very friendly.|1
”Mary isn't my daughter. She's my wife. Tom, that's outrageous! She's young enough to be your daughter!|2
Mary isn't my daughter. She's my wife.|1
Mary isn't my girlfriend.|1
Mary is my older sister.|1
Mary is a hairdresser now.|1
Mary is now a grown woman.|1
Mary is in love with you.|1
Mary is still engaged to Tom, isn't she?|1
Mary is a stubborn girl.|1
Mary is a pretty name.|1
Mary is a YouTuber.|1
Mary is a wealthy woman.|1
Mary is an artist renowned across the world.|1
Mary is a hardworking young lady.|1
Mary is transfeminine.|1
Mary is a trans woman.|1
Mary is a little cutie.|1
Mary is an obstinate woman.|1
Mary is a quiet woman.|1
Mary is a wealthy woman.|1
Mary is a heavy reader.|1
Mary is an artist whose works are known the world over.|2
Mary is a woman.|1
Mary is an accomplished writer.|1
Mary is the most beautiful woman in the whole world.|2
Mary is the love of my life.|1
Mary is a YouTuber.|1
Mary is more attractive than Alice.|1
Mary's a beginner, but she's a fast learner.|1
Tom said Mary hopes John will help Alice.|1
Mary hiked her skirt up to mid-thigh and dipped her toes in the water.|2
Maria has two sisters.|1
Mary has two beautiful red cheeks.|1
Mary has many friends.|1
Mary has never had a boyfriend.|1
Mary thought she was going to get a higher salary.|2
Mary's eyes sparkled.|1
Mary almost began to cry.|1
Mary had something important to say, but Tom kept interrupting her.|2
Mary was afraid that people were going to say bad things about her.|2
Mary has hired herself a car for the next two weeks.|2
Mary has hired herself a car for the next fortnight.|2
Mary has more clothes than Tom.|1
Mary has long golden hair.|1
Marie has lost her umbrella.|1
Mary is on telephone duty today.|1
Mary is answering the phone today.|1
Mary said that she was very upset.|1
Maria married unwillingly.|1
Maria married against her will.|1
Mary saw it, too.|1
Mary has a beautiful face.|1
Mary won a free car.|1
Mary has low self-esteem.|1
Mary is passive-aggressive.|1
Mary gave birth to a boy.|1
Mary's blanket has flowers on it.|1
Mary has three ex-husbands.|1
Mary has written three books.|1
Mary was able to work out this equation immediately. Well, she is a mathematician.|2
Mary didn't accept the presents.|1
Mary didn't accept the gifts.|1
Mary is a black belt in taekwondo.|1
Mary clapped.|1
Mary applauded.|1
Mary Jackson is a famous actress.|1
Mary says she doesn't think she's very good at French.|2
Mary said she thought she knew what had to be done.|2
Mary teaches French in London.|1
Mary won a prize in the spelling competition.|1
Mary seemed embarrassed for some reason that Tom couldn't understand.|2
Mary kissed Tom's cheek.|1
Mary gave her dog a bone.|1
Mary feels that her husband doesn't pay enough attention to her.|2
Mary made an angel in the snow.|1
Mary lacks the teaching materials she needs to give a decent class.|2
Mary found a job.|1
Mary had a panic attack.|1
Mary is napping on the sofa.|1
Mary doesn't have to sing if she doesn't want to.|2
Mary made her brother cry.|1
Mary made sandwiches for the hostages.|1
They nicknamed Mary 'Ladybug' because when she was little, she was very tiny and active.|2
Mary is growing vegetables in her garden.|1
Mary grows vegetables in her garden.|1
Mary asked Tom to call her after dinner.|1
Mary asked Tom to zip up her dress.|1
Mary asked me to go to Boston with her.|2
Mary works at an art gallery.|1
Mary works at a health food store.|1
Mary analyzed the results.|1
Mary is very much like her mother.|1
Mark took his stuff and left.|1
Marathi is the official language of Maharashtra state of India.|2
Maradona was a demigod. With the ball, he was a god. Without the ball, he was human.|2
It's rude to point your finger at people.|1
This is a very safe place to live.|1
You will be told where to sit.|1
Celebrities are often used to promote products.|1
They spoke to me in French, even though I told them I wanted to practice my English.|2
You should always wash your hands before meals.|1
You should never leave your makeup on overnight.|1
You shouldn't judge a person by his appearance.|1
One should never say never.|1
You should never cut corners on safety.|1
You ought not to speak ill of others behind their backs.|2
Never buy what you don't want because it is cheap.|2
Don't pay more for something than you need to.|2
Chocolate should not be given to dogs as it is toxic to them.|2
One sees the resilience of a person in a crisis situation.|2
That translation is said to be true to the original.|2
I hear that you're very good at what you do.|2
It is said to be carcinogenic.|1
Braces are used to straighten teeth.|1
Manny wants to be a unicorn so girls will ride him.|2
Men were attracted to her like moths to a flame.|2
Men sometimes overestimate their sexual prowess.|1
Men are like bears - the uglier they are, the more attractive they are.|2
There are as many men as there are stars.|2
It is called sick humor.|1
Males are always more beautiful than females.|1
Just looking through the windows, you could tell the house belonged to a hoarder.|2
You must make allowance for his lack of experience.|2
You do not need to like everything.|1
You'll have to wait no less than an hour to get a ticket.|2
Tell a lie often enough and it will become the truth.|2
You need to find the lowest common denominator.|1
Rumors have gone around that Mary secretly smokes.|1
Tom was starved to death.|1
They starved Tom to death.|1
You learn a lot by trying to solve chess problems - for example, how in a given position white will checkmate in three moves.|3
You live here with a constant perception that something may happen at any time.|2
You couldn't get two people more different than Tom and Mary.|2
We can hear the ocean from here.|1
You know you've really mastered a foreign language when you can write a decent poem in it.|2
You can't be sure of anything in this world.|2
You can't do anything wrong with learning a language.|2
You can't sprint if your food bar is at under three drumsticks.|2
One can’t live unless human speech adorns, / Nor gather roses past the reach of thorns.|2
You can't drink seawater because it's too salty.|1
You should not trust him.|1
You can't learn a foreign language in just a couple of weeks.|2
It is possible for you to read this book in a few days.|2
The meat can be thawed by leaving it in the fridge overnight.|2
You can search words, and get translations. But it's not exactly a typical dictionary.|2
One can classify books into good ones and bad ones.|2
You can't help being what you are.|1
You will never be too old to learn.|1
They like French.|1
Tom hasn't yet been found.|1
Tom should've been elected.|1
You could've heard a pin drop.|1
They should've picked a different voice actor.|1
You have been spotted.|1
I was given a new jacket.|1
It has been confirmed.|1
He was quickly recaptured.|1
It is said that she looked after the orphan.|2
It's OK to fight back when someone hurts you.|2
Any sort of bullying is not OK.|1
Any kind of bullying is not okay.|1
I even surprised myself sometimes.|1
Sometimes bears roam our village.|1
Sometimes the boys would play a trick on their teacher.|2
Sometimes you don't need to speak the same language in order to understand each other.|2
