sentence|category
Tom and Mary engaged in friendly banter.|1
Tom and Mary rented a house by the sea.|2
Tom and Mary said they were glad that they did that.|2
Tom and Mary are in the kitchen making themselves something to eat.|2
Tom and Mary don't know each other.|1
Tom and Mary stopped and picked up a hitchhiker.|2
Tom and Mary booked a room with two beds, but when they arrived at the hotel, there was only one bed.|3
Tom and Mary were worried about getting caught by the police.|2
Tom and Mary don't have much money so they seldom eat out.|2
Tom and Mary have kissed each other more than once.|2
Tom and Mary say they're willing to do that for us.|2
Tom and Mary told John that they liked doing that.|2
Tom and Mary told John they were hungry.|1
Tom and Mary told John that they were tired.|2
Tom and Mary told John that they were interested.|2
Tom and Mary told John they were thirsty.|1
Tom and Mary told John that they were embarrassed.|2
Tom and Mary played hockey.|1
It's Tom and Mary's wedding anniversary today.|1
Tom and Mary just got married last year.|1
I'm sure Tom and Mary haven't forgotten you.|1
Tom and Mary used to often do that together.|2
Tom and Mary say they believe they can do that without your help.|2
Tom and Mary went outside together to feed the animals.|2
Tom and Mary went for a walk even though it was raining.|2
Tom and Mary walked side by side.|1
Tom and Mary went outside.|1
Tom and Mary had a romantic picnic by the river.|2
Tom and Mary are going for a walk on the beach.|2
Tom and Mary went to the planetarium.|1
Tom and Mary are in a long-distance relationship. He lives in Hannover while she lives in Berlin; they meet on weekends.|3
Tom and Mary aren't happy here.|1
Tom and Mary started kissing each other as soon as the light was turned off.|2
Tom and Mary told John they had asked Alice to teach him how to do that.|2
Tom and Mary were discussing the pros and cons of raising the minimum wage.|2
Tom and Mary are outside making a snowman.|1
Tom and Mary are outside building a snowman.|1
Tom and Mary are making a cake together.|1
Tom and Mary are baking a cake together.|1
Tom and Mary aren't at all alike.|1
Tom and John are Mary's sons.|1
Tom and I'll go to Boston.|1
Tom and I are getting married.|1
Tom and I'll do that.|1
Tom and I share a room.|1
Tom and I are looking for Mary.|1
Tom and I sat next to each other on the train.|2
Tom and I have to leave.|1
Tom and I had coffee together.|1
Tom and I spent the day talking to each other.|2
Tom and I have nothing in common.|1
Tom and I sometimes work together.|1
Tom and I work in the same office.|1
Tom and Anne have been friends since elementary school.|2
Tom is translating this book into nine different languages.|2
Tom crossed the Atlantic Ocean.|1
Tom checked to see whether Mary's name was on the list.|2
Tom checked to see if Mary's name was on the list.|2
Tom's thinking of moving to a cabin out in the middle of nowhere.|2
Tom is thinking of moving to a cabin out in the middle of nowhere.|2
Tom suddenly felt hungry.|1
Tom doesn't do anything without first asking Mary if it's OK.|2
I almost feel sorry for Tom.|1
Tom has done that for three years.|1
Tom carried Mary's suitcase to her room.|1
Tom had no hat on.|1
Tom didn't have his helmet on.|1
Tom wore a neck brace for several months after receiving a whiplash injury in a car accident.|2
Tom dried his tears.|1
Tom drinks tea while Mary drinks coffee.|1
Tom drinks tea and Mary drinks coffee.|1
Tom drinks tea, but Mary drinks coffee.|1
Tom prefers to drink tea rather than coffee in the morning.|2
Tom drinks a cup of tea or coffee in the morning.|2
In the morning, Tom drinks a cup of tea or coffee.|2
Tom doesn't drink juice.|1
Tom doesn't drink cold tea.|1
Tom likes vodka.|1
Tom likes cognac.|1
Tom is drinking his third beer.|1
Tom drinks almost every day.|1
Tom was overdoing it.|1
Tom didn't trust Mary one bit.|1
Tom often dreams of his girlfriend.|1
Tom stepped away from the door.|1
Tom slammed on the brakes.|1
Tom joined us.|1
Tom's eyes watered as he chopped the onions.|1
Tom took a sip of tea, trying to calm down.|2
Tom took a sip of his coffee.|1
Tom only wears brand-name clothes.|1
Tom never wears a hat.|1
Tom is wearing a new pair of shoes.|1
Tom is wearing someone else's coat.|1
Tom is wearing somebody else's coat.|1
Tom doesn't like wearing pants around the house.|1
Tom is wearing a blue sweater today.|1
Tom wears a suit almost every day.|1
Tom is wearing sunglasses.|1
Tom is applying ointment to his wound.|1
Tom is wearing someone else's coat.|1
Tom is wearing somebody else's coat.|1
Tom is wearing someone else's coat.|1
Tom is wearing somebody else's coat.|1
Tom is wearing what he wore yesterday.|1
Tom met up with his friends after school.|1
Tom got here just before lunch, and Mary got here a couple of hours after that.|2
Tom made a wise decision.|1
Tom won't kill animals.|1
Tom doesn't kill animals.|1
Tom killed a bear.|1
Tom? Tom Jackson? The very same.|1
Tom shared his bar of chocolate with Mary.|1
Tom shared his sandwich with Mary.|1
Tom is replacing the towels in the bathroom.|1
Tom pretended that he knew what was going on.|2
Tom pretended to be hard of hearing.|1
Tom pretended that he didn't see what was happening.|2
Tom pretended that he was listening.|1
Tom pretended he was listening.|1
Tom put some salad on his plate.|1
Tom put milk in his tea.|1
Tom did nothing but watch TV all day.|1
Tom just laughed it off.|1
Tom did that out of a sense of duty.|2
Tom went out of his way to make their honeymoon truly memorable.|2
Tom's room is empty.|1
What Tom said to me felt like a shot to the heart.|2
Tom's apartment is small, but it's very cozy.|1
Tom is looking for his shoes.|1
Tom is looking for his wallet.|1
Tom is looking for a pencil.|1
Tom is looking for a bigger apartment.|1
Tom studies philosophy at college.|1
Tom is painting the wall blue.|1
Tom stuffed a rag in the hole.|1
Tom stuffed the money into his pocket.|1
All of three of Tom's daughters are beautiful.|1
Tom banged his head.|1
Tom got into his car and drove off.|1
Tom got into his car and quickly drove off.|2
Tom got on the train.|1
Tom got off the bus and waited for Mary to come and pick him up.|2
Tom lost his temper.|1
Tom is always asking dumb questions.|1
Tom introduced himself to everybody.|1
Tom parked his car in the vacant lot next to Mary's house.|2
Tom introduced me to his roommate.|1
Tom introduced Mary to his family.|1
Tom asked Mary several questions.|1
Tom didn't even ask one question.|1
Tom set the alarm clock to go off 6:00 a.m.|2
Tom questioned everything.|1
Tom makes his own wine at home.|1
Tom's getting up at nine o'clock.|1
Tom is getting up at nine o'clock.|1
Tom gets up at nine o'clock.|1
Tom isn't listed in the phone book.|1
Tom gets up before dawn most mornings.|1
Tom rises with the sunrise.|1
Tom was staring at us.|1
Tom died last year.|1
Tom died in Mary's arms.|1
Tom died in the blast.|1
Tom died a quick death.|1
Tom died from tuberculosis.|1
Tom was killed by a snakebite.|1
Tom died on Monday morning.|1
Tom was in the shower.|1
Tom stood very close to Mary.|1
Tom woke up in the middle of the night and ate an entire bag of cookies.|2
Tom stood outside the restaurant for a long time before entering.|2
Tom stood up and then everybody else stood up as well.|2
Tom got up and left the room.|1
Tom got up and hurriedly limped away.|1
The third name on the list was Tom.|1
Tom mashed the potatoes.|1
Tom stole the money.|1
Tom's prank went too far and Mary ended up crying.|2
Tom's strategy is working.|1
Tom's voice sounds like a woman's.|1
Tom's constant politeness bugs me.|1
Tom's locker is next to Mary's.|1
Tom's son is pulling faces.|1
Tom's sisters are both married.|1
Tom's silence surprised me.|1
Tom's sobs could be heard from the next room.|2
Tom's sandcastle was destroyed by the storm.|1
Tom's clothes smell like smoke.|1
Tom's restaurant is full all the time.|1
Tom sensed danger.|1
Tom feels that his team will win the game.|2
Tom rinsed off the plates and put them into the dishwasher.|2
Tom is spraying his garden.|1
Tom can't speak French, but he enjoys reading comics in French.|2
Tom speaks many languages, including French.|1
Tom talks very loud.|1
Tom speaks perfect German.|1
Tom speaks French to his grandparents.|1
Tom speaks with his mother every day.|1
Tom always speaks with robotic precision.|1
Tom will speak to you tonight.|1
Tom will speak to you tonight.|1
Tom speaks English as well as you.|1
Tom doesn't speak French at all.|1
Tom speaks passable Hindi and Russian.|1
Tom speaks English just as well as you guys.|2
Tom speaks English as well as you.|1
Tom speaks French, doesn't he?|1
Tom speaks excellent French, but his English isn't very good.|2
Tom is a native speaker of American English.|1
Tom jumped over the hedge.|1
Tom was talking very loudly.|1
Tom spoke louder than usual.|1
Tom spoke in a loud whisper.|1
Tom very rarely plays the clarinet anymore.|1
Tom is playing with his yo-yo.|1
Tom plays the cello with one of the local orchestras.|2
Tom enjoys playing the piano.|1
Tom was playing cards with Mary.|1
Tom played the plum tree in the stage-play.|1
Tom played the part of Hamlet.|1
Tom played an old Irish song on his new French horn.|2
Tom plays tennis three times a week.|1
Tom really likes playing the guitar.|1
Tom donated his winnings to charity.|1
Tom donated all of his winnings to charity.|1
Tom donated the prize money to charity.|1
Tom shouldn't make fun of Mary's limp.|1
I wanted Tom to clean his bedroom.|1
It's well past Tom's bedtime.|1
Tom was never to see Mary again.|1
Tom should be studying French now.|1
Tom should go help Mary.|1
Tom should send a letter of apology.|1
Tom should be getting paid more.|1
Ask Tom to come immediately.|1
Tom is going to have surgery.|1
Don't let Tom eat dessert until he eats everything on his plate.|2
I don't like Tom's new hat.|1
Tom's name was easy to convert to katakana.|1
Tom's mom is cool.|1
Tom's mother died on Mother's Day.|1
Tom's rent is three hundred dollars a month.|1
I suspect this happened because of what Tom did.|2
Tom's left sleeve was torn.|1
Tom's left sleeve is torn.|1
Tom's favourite song is Nuts by the band The Squirrels.|2
Tom's favorite dinosaur is the stegosaurus.|1
Tom's teacher called to say that Tom has been bullying a couple of kids at school.|2
Tom's children can only speak French.|1
Tom's children are trying to memorize the words to the national anthem.|2
Tom's children can only speak French.|1
Tom's coffee is good.|1
Tom is sitting between his friends.|1
Tom is back behind bars.|1
Tom has been sitting on the riverbank for hours.|2
Tom sits in front of the TV all day.|2
Tom loves singing.|1
Tom looks like an adult.|1
Tom is strikingly handsome.|1
Tom doesn't like watching YouTube videos because of all the ads.|2
Tom looks sleepy.|1
Tom doesn't look happy.|1
Tom looks weary.|1
Tom sees Mary almost every day.|1
Tom looks sick.|1
Tom looks different today.|1
Tom likes watching TV.|1
Tom likes American movies, but Mary likes European movies.|2
Tom looks bummed.|1
Tom looks like his brother.|1
Tom looks like he's about to cry.|1
Tom looks as though he's about to cry.|1
Tom looks down on women.|1
Tom's dog needs to get out.|1
Tom's dog attacked Mary.|1
I don't appreciate Tom's humor.|1
Tom's hobby is collecting stamps.|1
Tom's house has a chimney.|1
That's not the main reason Tom wanted to do that.|2
Tom's confession was shocking.|1
Tom's story didn't add up.|1
Tom's driving licence has expired.|1
Tom's driver's license has expired.|1
Tom's rudeness made me angry.|1
Tom's rude reply provoked Mary to slap his face.|2
Tom's French got better after he started studying grammar.|2
Tom's company imports coffee from Brazil.|1
Tom's fingers are like a woman's.|1
Tom's arrest wasn't unexpected.|1
Tom's family is in Australia.|1
Tom's family didn't have much money.|1
Tom's bicycle is in the garage.|1
Tom's bicycle isn't new, but Mary's is.|1
Tom kept sighing.|1
Tom is learning about his rights as a citizen.|2
Tom sat down underneath a tree.|1
Tom sat next to her and began to rub her back.|2
Tom checkmated Mary on the tenth move.|1
Sit down, Tom. All right.|1
Tom's first wife was from Boston.|1
Tom's decision to get married surprised his family.|1
Tom's parents live in an old trailer.|1
Tom's parents have a lot of money.|1
Tom's only backup plan in case things went wrong was to fake a heart attack.|2
Tom's German is still weak.|1
Tom has piles of money.|1
Tom swam in the pond behind his house.|1
Tom poured some milk from the bottle into a bowl for his cat.|2
Tom owes me rent.|1
Tom wrote home to his girlfriend.|1
Tom wrote Mary a love letter, but he didn't send it.|2
Tom wrote a children's book that became a best seller.|2
Tom wrote a letter to Santa.|1
Tom is writing his autobiography.|1
Tom shot at Mary with a crossbow.|1
Tom fired his gun as soon as he saw me.|2
Tom scored three goals for his team.|1
Tom gets his drinking water from a well on his property.|2
Tom slowly advanced.|1
Tom advanced slowly.|1
Tom sliced the carrots.|1
Tom sliced the banana with a knife.|1
Tom didn't like his sandwich.|1
Tom didn't like the cookies that Mary baked.|1
Tom beat Mary black and blue.|1
Tom slammed the door behind him.|1
Tom took Mary in his arms and kissed her.|2
Tom shut the door behind him.|1
Tom shut the kitchen door.|1
Tom unlocked the front door.|1
Tom fell asleep almost instantly.|1
Tom was sleeping when I looked into his room.|2
Tom was asleep when I left.|1
Tom is asleep. Should I wake him up?|1
Tom is asleep. Should I wake him?|1
Tom usually sleeps in on Saturdays and Sundays.|1
Tom falls asleep as soon as he gets into bed.|2
Tom emptied his piggy bank to buy Mary a gift.|2
Tom seemed quite disorganized.|1
Tom didn't seem interested in anything else.|1
Tom seemed to have been very busy.|1
Tom didn't look happy.|1
Tom seemed satisfied with the pay he was getting.|2
Tom didn't seem to understand at first.|1
Tom seemed pretty upset about it.|1
Tom appeared intoxicated.|1
Tom sounded genuinely concerned.|1
Tom always blames his mistakes on me.|1
Tom gave me a dirty look.|1
Tom sent Mary to Boston.|1
Tom sent a message to Mary.|1
Tom sent the picture to Mary, who in turn sent it to Alice.|2
Tom was joking around with his friends.|1
Tom poured me another drink.|1
Tom paid no attention to me.|1
Tom gave flowers to Mary.|1
Tom seems angry.|1
Tom appears awkward.|1
Tom doesn't seem to be able to make up his mind.|2
Tom seems to be aware of my feelings.|1
Tom seems very opinionated.|1
Tom seems very concerned.|1
Tom doesn't seem to be as tolerant as Mary seems to be.|2
Tom doesn't seem like himself.|1
Tom seems to have no sense of humor.|1
Tom seems to always be sick.|1
Tom seems to be really scared.|1
Tom seems annoyed.|1
Tom seems to be bored.|1
Tom seems to be asleep.|1
It seems Tom does this.|1
Tom seems anxious.|1
Tom looks up to you.|1
Tom often watches horror movies.|1
Tom looked around the waiting room.|1
Tom had a scowl on his face.|1
Tom switched off the light to save electricity.|1
Tom always finds ways to make me laugh.|1
Tom's brother Tim is an enchanter who's scared of rabbits.|2
Tom's blood pressure is too low.|1
Tom's blood pressure is too high.|1
Tom's request surprised Mary.|1
Tom's request is unreasonable.|1
Tom's remark was tactless and insensitive.|1
Tom's funeral is taking place this weekend.|1
Tom's car was blue and Mary's was red.|1
Tom was sitting in a comfortable armchair, reading the evening newspaper.|2
Tom was on the same plane as Mary was.|2
Tom sat on top of his desk, looking out the window.|2
Tom sat on the floor and cried.|1
The way Tom speaks gets on my nerves.|1
I don't like the way Tom teaches English.|1
I'm sure Tom's answer would've been no.|1
Tom sang Mary to sleep.|1
Tom looked rather pathetic.|1
Tom really looked terrible.|1
Tom saw Mary and John talking.|1
Tom saw something moving.|1
Tom saw Mary trip.|1
Tom saw John and Mary holding hands.|1
Tom saw cops surrounding his house.|1
Tom looked unkempt after not shaving for three days.|2
Tom looked both ways before crossing the street.|1
Tom looked around the room, making sure that everything was alright.|2
Tom looked around the locker room.|1
Tom watched a movie about penguins.|1
Tom looked very tired when I saw him yesterday.|2
Tom looked very young.|1
Tom looked very good.|1
Tom stared into my eyes and I stared back into his.|2
Tom saw Mary's car in John's driveway.|1
Tom saw Mary talking to someone that he didn't know.|2
Tom saw Mary talking to someone he didn't know.|2
Tom saw Mary talking to somebody that he didn't know.|2
Tom saw Mary talking to somebody he didn't know.|2
Tom saw Mary going into the cave.|1
Tom saw Mary enter the cave.|1
Tom saw Mary again a year later.|1
Tom saw Mary do that.|1
Tom saw Mary sitting by herself at the bar.|2
Tom peeked into Mary's medicine cabinet.|1
Tom peeked into Mary's medicine cabinet.|1
Tom saw a bottle of champagne in the kitchen.|2
Tom looked into the room.|1
Tom didn't see any children in the park.|1
Tom looked well.|1
Tom saw footprints in the sand.|1
Tom saw a man wearing a hat standing next to Mary and wondered who he was.|2
Tom saw an old woman begging in the street.|2
Tom saw three ships.|1
Tom looked through the file.|1
Tom saw a car parked in front of Mary's house.|2
Tom looked at his watch and saw that he only had five minutes left until lunchtime.|2
Tom looked at his watch.|1
Tom saw Mary across the street.|1
Tom says Mary is wrong.|1
Tom said that he was busy, but he wasn't.|2
Tom said he was busy, but he wasn't.|1
Tom said that he didn't care who did it, as long as it got done.|2
Tom said that we should stop what we were doing.|2
Tom said very little.|1
Tom says he doesn't know.|1
Tom says he's fluent in three languages.|1
Tom says he doesn't do that.|1
Tom says he can't wait any longer.|1
Tom says that he can drink a whole bottle of whiskey without getting drunk.|2
Tom says that he saw a ghost walking around the abandoned house.|2
Tom says he has never tried eating whale meat.|2
Tom says he has nothing to do with the matter.|2
Tom says he has a secret weapon.|1
Tom didn't say where or when to meet him.|2
Tom told me what he wanted.|1
Tom told me that he was hungry.|1
Tom told me that he didn't want to come home empty-handed.|2
Tom told me that he hadn't done that yet.|2
Tom told me that he would do it tomorrow.|2
Tom told Mary that he had finished the work a few days ago.|2
Tom said that Mary wouldn't be mad.|1
Tom told Mary to come back later.|1
Tom told Mary not to interfere in his personal affairs.|2
Tom said that Mary's complaining didn't bother him.|1
Tom told Mary that he'd kissed Alice.|1
Tom said you might be able to help.|1
Tom said he was aching all over.|1
Tom said I was the only one who said thank you.|2
Tom said he wants to be your friend.|1
Tom said that he'd look at it.|1
Tom said he didn't want to go to the park with us.|2
Tom said that he didn't want to go to bed.|2
Tom said that he didn't want to come in.|2
Tom said he didn't want to come in.|1
Tom said he wanted to play poker with us.|2
Tom said that he wanted to teach me French.|2
Tom said he'd prefer to go there alone.|1
Tom said he'd prefer to go there alone.|1
Tom says he won't do that unless Mary helps him.|2
Tom said he didn't know what he was supposed to do.|2
Tom says he'll keep working hard.|1
Tom said he wouldn't do it again.|1
Tom said that he wished he were a fish.|2
Tom said that he'd like to be a fish.|2
Tom said he wished he were a fish.|1
Tom said he'd like to be a fish.|1
Tom said that he was very discouraged.|1
Tom said he grew up in Boston.|1
Tom said he was exhausted.|1
Tom said he wouldn't shoot an unarmed man.|1
Tom said he was from Australia.|1
Tom said he had half a mind to throw in his job and hitchhike around Australia.|2
Tom said he didn't think that it was possible.|2
Tom said that he had things that he needed to do.|2
Tom told me that he had feelings for me since he first met me.|2
Tom said that he had eaten.|1
Tom said that he'd eaten.|1
Tom said he had eaten.|1
Tom said he'd eaten.|1
Tom said that he wasn't planning to do that.|2
Tom said that he didn't know that Mary could speak French.|2
Tom said he heard Mary's voice.|1
Tom said he didn't have time to read the newspaper this morning.|2
Tom said he had a craving for chocolate.|1
Tom said that he thought Mary understood.|1
Tom said he didn't believe Mary would really do that.|2
Tom said that he thought Mary was good-looking.|1
Tom said he regretted what had happened.|1
Tom said that you'd be able to help me.|2
Tom said that I could spend the night at his place.|2
Tom said that it might be true.|1
Tom said he was so full he had no room left for dessert.|2
Tom said that he couldn't wait anymore.|1
Tom said that he loved Mary.|1
Tom says he enjoys speaking French.|1
Tom says it's a waste of time to try to please everybody.|2
Tom says he doesn't have any regrets.|1
Tom says that he detests war.|1
Tom says he's doing that.|1
Tom says he's willing to do just about anything for me.|2
Tom slipped and fell on the ice.|1
Tom rested in the shade of a tree.|1
Tom bragged about it.|1
Tom ripped off the band-aid.|1
Tom advised me to hire a lawyer.|1
Tom discouraged me from doing that.|1
Tom advised him not to buy the secondhand car.|2
Tom advised the job applicant to redo her resume.|2
Tom called Mary to ask if everything was OK.|2
Tom called to say he'd be late.|1
Tom saved her from the fire.|1
Tom reserved a seat.|1
Tom is fixing his car.|1
Tom fixed the dripping tap.|1
Tom is repairing the fence in the garden.|1
Tom is mending the fence in the garden.|1
Tom has been riding horses all his life.|1
Tom traveled around Southeast Asia.|1
Tom handed Mary a book.|1
Tom handed Mary the letter.|1
Tom filed a complaint.|1
Tom talked all night.|1
Tom didn't expect to see Mary again.|1
Tom spent all afternoon cleaning his room.|1
Tom doesn't smoke, does he?|1
Tom was smoking a hand-rolled clove cigarette.|1
Tom shaves his legs.|1
Tom shaves his armpits.|1
Tom is shaving his beard.|1
Tom ran for his life.|1
Tom rushed out onto the road without looking both ways.|2
Tom ran down the hill.|1
Tom wrestled Mary to the ground and ate the last of the cheese from her hands.|2
Tom wiped his nose.|1
Tom tasted the potatoes.|1
Tom wants to surprise Mary.|1
Tom planted some carrots.|1
Tom was whistling a tune.|1
Tom is a bad match for Mary.|1
Tom doesn't seem to be paying attention.|1
Tom unwrapped his sandwich and started eating it.|1
Tom sacrificed himself to save his family.|1
Tom nervously opened the door.|1
Tom opened the toolbox and took out a wrench.|2
Tom opened the door and the dog ran out.|2
Tom opened the door just a crack.|1
Tom opened the conference room door.|1
Tom opened the cages.|1
Tom opened his car door with a little too much force and accidentally dinged the car parked next to him.|2
Tom opened the envelope, took out the letter, and started to read it.|2
Tom used what John told him as leverage.|1
Tom is in the bathtub having a bath.|1
Tom is having a bath.|1
Tom has a tendency to get a little worked up.|2
Tom was outspoken.|1
Tom took a cab.|1
Tom helped himself to some cookies.|1
Tom didn't take off his watch.|1
Tom didn't take his watch off.|1
Tom took off his wedding ring and threw it into the pond.|2
Tom wasn't gaining weight.|1
Tom didn't take Mary seriously.|1
Tom took a piece of candy from the bag.|2
Tom assumed Mary caught a fish.|1
Tom took piano lessons when he was a kid.|2
Tom accepted all the cookies.|1
Tommy is a nice man.|1
Tom needs to see a dentist.|1
Tom has to be home.|1
Tom has to be more careful.|1
Tom doesn't have to thank us.|1
Tom threw up before the concert because he was so nervous.|2
Tom got stuck doing something that he didn't want to do.|2
Tom had to live with the consequences of his actions.|2
Tom had to go to the emergency room by ambulance.|2
Tom must be tired now.|1
Tom had to wait a long time in the hospital before he was examined.|2
Tom had to wait a long time in hospital before he was seen to.|2
Tom had to wait a long time in hospital before he was examined.|2
Tom had to beg on the streets to survive.|2
Tom has to stop doing that right now.|1
Tom has to have surgery.|1
Tom needs to put his things away.|1
Tom must be rich.|1
Tom doesn't have to go in there.|1
Tom needs to stay where he is.|1
Tom has some very important things he needs to get done by 2:30.|2
Tom has to listen to us.|1
Tom must be nearly thirty.|1
Tom wants to spend time with Mary.|1
Tom wants to know why you didn't call him back.|2
Tom wants to get to know you.|1
Tom wants to extend his lease.|1
Tom didn't like children until he had his own.|2
Tom liked it, too.|1
Tom wants us to follow him.|1
Tom wants you to do it for him.|1
Tom didn't like the look of his nose, so he had a nose job.|2
Tom wants to be famous.|1
Tom shuffled the cards.|1
Tom avoided places where people smoked.|1
Tom realized that Mary didn't really like him very much.|2
Tom didn't think Mary could do it.|1
Tom told me I should spend more time with my family.|2
Tom said that he doesn't think that Mary really wants to do that.|2
Tom has been painting for as long as he can remember.|2
Tom likes our dog.|1
Tom likes both meat and fish.|1
Tom doesn't like Mary very much.|1
Tom doesn't like Mary. However, she doesn't particularly care whether he likes her or not.|2
Tom doesn't like people who get angry easily.|1
Tom doesn't like long car rides.|1
Tom doesn't like bright lights.|1
Tom doesn't like working on an empty stomach.|1
Tom likes Italian food.|1
Tom does that when he's sad.|1
Tom is doing his homework.|1
Tom always makes me angry.|1
Tom isn't kidding.|1
Tom exercises every day to keep fit.|1
Tom goes jogging every morning.|1
Tom is cleaning his apartment.|1
Tom warmed up a can of ravioli for dinner.|2
Tom heated up a tin of ravioli for dinner.|2
Tom heated up a can of ravioli for dinner.|2
Tom heated a tin of ravioli up for tea.|2
Tom began to eat lunch.|1
Tom is doing a fine job.|1
